{
  "contract_version": "1.0",
  "command_id": "cmd-550e8400-e29b-41d4-a716-446655440001",
  "event_id": "evt-550e8400-e29b-41d4-a716-446655440000",
  "device_id": "pi5-home-01",
  "command_type": "guardian_response",
  "created_at": "2026-09-16T07:31:05Z",
  "expires_at": "2026-09-16T07:36:05Z",
  "payload": {
    "response_id": "resp-550e8400-e29b-41d4-a716-446655440002",
    "action": "confirmed_safe",
    "reason": "가족이 함께 있어 정상 상황으로 확인했습니다.",
    "responded_at": "2026-09-16T07:31:00Z",
    "responder_id": "guardian-primary"
  }
}

